{
  "schema_version": 1,
  "issue_date": "2016-04-15",
  "subject": "5-Bullet Friday",
  "sources": [
    "hotmail"
  ],
  "status": "email",
  "extraction_status": "extracted",
  "special_edition": true,
  "bullets": [
    {
      "position": 1,
      "section": "What I’m watching —",
      "category": "video",
      "title": "The Fog of War",
      "creator": null,
      "note": "This documentary has been recommended to me countless times (the last person\nwas Morgan Spurlock, during [our podcast\ntogether](http://www.fourhournewsletter.com/click.html?x=a62e&lc=wOq&mc=e&s=bomwH&u=w&y=C&),\nand I finally bit the bullet. It’s… amazing. At [98% on Rotten\nTomatoes](http://www.fourhournewsletter.com/click.html?x=a62e&lc=wOU&mc=e&s=bomwH&u=w&y=y&),\nI shouldn’t have been surprised. The synopsis: Former Secretary of Defense\nRobert S. McNamara is the sole focus of documentarian Errol Morris' The Fog of\nWar, a film that not only analyzes McNamara's controversial decisions during\nthe first half of the Vietnam War, but also his childhood upbringing, his\neducation at Berkeley and Harvard, his involvement in World War II, and his\nlater years as president of the World Bank. Culling footage from almost 20\nhours of interviews with the Secretary, Morris details key moments from\nMcNamara's career, including most important lessons learned.",
      "original_url": "http://www.fourhournewsletter.com/click.html?x=a62e&lc=wOQ&mc=e&s=bomwH&u=w&y=H&",
      "links": [
        {
          "type": "original",
          "url": "http://www.fourhournewsletter.com/click.html?x=a62e&lc=wOQ&mc=e&s=bomwH&u=w&y=H&"
        },
        {
          "type": "other",
          "url": "http://www.fourhournewsletter.com/click.html?x=a62e&lc=wOq&mc=e&s=bomwH&u=w&y=C&"
        },
        {
          "type": "other",
          "url": "http://www.fourhournewsletter.com/click.html?x=a62e&lc=wOU&mc=e&s=bomwH&u=w&y=y&"
        },
        {
          "type": "justwatch",
          "url": "https://www.justwatch.com/us/search?q=The%20Fog%20of%20War",
          "region": "US",
          "search_fallback": true
        },
        {
          "type": "kanopy",
          "url": "https://www.kanopy.com/en/search?query=The%20Fog%20of%20War",
          "region": "US",
          "requires_participating_library": true,
          "search_fallback": true
        },
        {
          "type": "justwatch",
          "url": "https://www.justwatch.com/us/movie/the-fog-of-war",
          "region": "US",
          "catalog_match": "imdb_exact_title",
          "catalog_title": "The Fog of War",
          "catalog_year": 2003,
          "imdb_id": "tt0317910",
          "media_kind": "movie"
        }
      ]
    },
    {
      "position": 2,
      "section": "What I’m reading —",
      "category": "article",
      "title": "The Tail End",
      "creator": "Tim Urban — If you only read one article this month, please make it this one",
      "note": "one](http://www.fourhournewsletter.com/click.html?x=a62e&lc=wOs&mc=e&s=bomwH&u=w&y=R&).\nIt was recommended to me by [Matt\nMullenweg](http://www.fourhournewsletter.com/click.html?x=a62e&lc=wa4&mc=e&s=bomwH&u=w&y=r&)\nand uses diagrams to really underscore how short life is. Here’s just one gem:\n\"It turns out that when I graduated from high school, I had already used up\n93% of my in-person parent time. I’m now enjoying the last 5% of that time.\nWe’re in the tail end.” Might be time for you (and me) to rethink our\npriorities. Read this as a catalyst.",
      "original_url": "http://www.fourhournewsletter.com/click.html?x=a62e&lc=wOs&mc=e&s=bomwH&u=w&y=R&",
      "links": [
        {
          "type": "original",
          "url": "http://www.fourhournewsletter.com/click.html?x=a62e&lc=wOs&mc=e&s=bomwH&u=w&y=R&"
        },
        {
          "type": "other",
          "url": "http://www.fourhournewsletter.com/click.html?x=a62e&lc=wOs&mc=e&s=bomwH&u=w&y=R&"
        },
        {
          "type": "other",
          "url": "http://www.fourhournewsletter.com/click.html?x=a62e&lc=wa4&mc=e&s=bomwH&u=w&y=r&"
        }
      ]
    },
    {
      "position": 3,
      "section": "Most popular post on Facebook —",
      "category": "other",
      "title": "The Most Important Skill to Teach Your Dog",
      "creator": null,
      "note": null,
      "original_url": "http://www.fourhournewsletter.com/click.html?x=a62e&lc=waw&mc=e&s=bomwH&u=w&y=Z&",
      "links": [
        {
          "type": "original",
          "url": "http://www.fourhournewsletter.com/click.html?x=a62e&lc=waw&mc=e&s=bomwH&u=w&y=Z&"
        },
        {
          "type": "amazon",
          "url": "https://www.amazon.com/s?k=The%20Most%20Important%20Skill%20to%20Teach%20Your%20Dog",
          "search_fallback": true
        },
        {
          "type": "worldcat",
          "url": "https://search.worldcat.org/search?q=The%20Most%20Important%20Skill%20to%20Teach%20Your%20Dog",
          "search_fallback": true
        }
      ]
    },
    {
      "position": 4,
      "section": "Music I’m jamming to —",
      "category": "music",
      "title": "45",
      "creator": "Shinedown",
      "note": null,
      "original_url": "http://www.fourhournewsletter.com/click.html?x=a62e&lc=wad&mc=e&s=bomwH&u=w&y=2&",
      "links": [
        {
          "type": "original",
          "url": "http://www.fourhournewsletter.com/click.html?x=a62e&lc=wad&mc=e&s=bomwH&u=w&y=2&"
        },
        {
          "type": "other",
          "url": "http://www.fourhournewsletter.com/click.html?x=a62e&lc=wae&mc=e&s=bomwH&u=w&y=x&"
        },
        {
          "type": "spotify_track",
          "url": "https://open.spotify.com/search/45%20Shinedown",
          "search_fallback": true
        },
        {
          "type": "spotify_track",
          "url": "https://open.spotify.com/track/420JGkyLfLUZcgBHKiIK9v",
          "catalog_match": "verified_title_creator"
        }
      ]
    },
    {
      "position": 5,
      "section": "Quote I’m pondering, once again —",
      "category": "quote",
      "title": "“I prefer to be true to myself, even at the hazard of incurring the ridicule of others, rather than to be false, and to incur my own abhorrence.” ― Frederick Douglass",
      "creator": "Frederick Douglass",
      "note": null,
      "original_url": "http://www.fourhournewsletter.com/click.html?x=a62e&lc=wab&mc=e&s=bomwH&u=w&y=T&",
      "links": [
        {
          "type": "original",
          "url": "http://www.fourhournewsletter.com/click.html?x=a62e&lc=wab&mc=e&s=bomwH&u=w&y=T&"
        },
        {
          "type": "other",
          "url": "http://www.fourhournewsletter.com/click.html?x=a62e&lc=wa1&mc=e&s=bomwH&u=w&y=D&"
        },
        {
          "type": "other",
          "url": "http://www.fourhournewsletter.com/click.html?x=a62e&lc=wat&mc=e&s=bomwH&u=w&y=W&"
        },
        {
          "type": "other",
          "url": "http://multimedia.fourhournewsletter.com/4hourweek/1/1/photos/5182.png?img1460693544036"
        },
        {
          "type": "other",
          "url": "http://www.fourhournewsletter.com/click.html?x=a62e&lc=waL&mc=e&s=bomwH&u=w&y=g&"
        },
        {
          "type": "other",
          "url": "http://multimedia.fourhournewsletter.com/4hourweek/1/1/photos/5186.jpg?img1460693544036"
        }
      ]
    }
  ]
}
