{
  "schema_version": 1,
  "issue_date": "2017-07-07",
  "subject": "5-Bullet Friday",
  "sources": [
    "hotmail"
  ],
  "status": "email",
  "extraction_status": "extracted",
  "special_edition": true,
  "bullets": [
    {
      "position": 1,
      "section": "What I’m excited about —",
      "category": "other",
      "title": "here it is",
      "creator": null,
      "note": "](https://el2.fourhourmail.com/c/xmumv0zqqa6hp8vp7/l178yv/aHR0cDovL3RpbS5ibG9nLzIwMTcvMDcvMDYvdGFvLW9mLXNlbmVjYS8=)_My\nteam and I have been working on this for more than six months, and it’s\nfinally finished! Subscribers to this newsletter are seeing it first, and[here\nit\nis](https://el2.fourhourmail.com/c/xmumv0zqqa6hp8vp7/q1opyg/aHR0cDovL3RpbS5ibG9nLzIwMTcvMDcvMDYvdGFvLW9mLXNlbmVjYS8=).\n[The Tao of Seneca (ebook\nedition)](https://el2.fourhourmail.com/c/xmumv0zqqa6hp8vp7/x1zvjk/aHR0cDovL3RpbS5ibG9nLzIwMTcvMDcvMDYvdGFvLW9mLXNlbmVjYS8=)\nis a small thank-you gesture to all of you -- three volumes of Stoic writing,\nstarring Seneca, complete with original illustrations, Japanese and Chinese\ncalligraphy to match themes, profiles of modern Stoic figures, interviews, and\nmuch more. It’s totally free.You can [download the PDFs\nhere](https://el2.fourhourmail.com/c/xmumv0zqqa6hp8vp7/e1pnyl/aHR0cDovL3RpbS5ibG9nLzIwMTcvMDcvMDYvdGFvLW9mLXNlbmVjYS8=).\nSharing is encouraged. I hope you find Seneca’s wisdom as life changing as I\nhave. I also owe a very special thanks to my entire team and all of the\ncontributors who took part in the project. Thank you!**",
      "original_url": "https://el2.fourhourmail.com/c/xmumv0zqqa6hp8vp7/q1opyg/aHR0cDovL3RpbS5ibG9nLzIwMTcvMDcvMDYvdGFvLW9mLXNlbmVjYS8=",
      "links": [
        {
          "type": "original",
          "url": "https://el2.fourhourmail.com/c/xmumv0zqqa6hp8vp7/q1opyg/aHR0cDovL3RpbS5ibG9nLzIwMTcvMDcvMDYvdGFvLW9mLXNlbmVjYS8="
        },
        {
          "type": "other",
          "url": "https://el2.fourhourmail.com/c/xmumv0zqqa6hp8vp7/x1zvjk/aHR0cDovL3RpbS5ibG9nLzIwMTcvMDcvMDYvdGFvLW9mLXNlbmVjYS8="
        },
        {
          "type": "other",
          "url": "https://el2.fourhourmail.com/c/xmumv0zqqa6hp8vp7/e1pnyl/aHR0cDovL3RpbS5ibG9nLzIwMTcvMDcvMDYvdGFvLW9mLXNlbmVjYS8="
        }
      ]
    },
    {
      "position": 2,
      "section": "What I’m reading —",
      "category": "article",
      "title": "This tweet storm",
      "creator": "Naval Ravikant on cryptocurrency and blockchain technology",
      "note": "[Here is a\nuseful\nsummary](https://el2.fourhourmail.com/c/xmumv0zqqa6hp8vp7/ly60ym/aHR0cHM6Ly90d2l0dGVyLmNvbS9DcnlwdG9ub29iaWUvc3RhdHVzLzg3NzUyNTQ5MjE2MDc1Nzc2MQ==)**.**\nIf you’d like a Bitcoin and Blockchain 101 class, my recent podcast episode\nwith Nick Szabo and Naval covers the basics, as well as some wilder stuff\n(“[The Quiet Master of\nCryptocurrency](https://el2.fourhourmail.com/c/xmumv0zqqa6hp8vp7/gykm1o/aHR0cDovL3RpbS5ibG9nLzIwMTcvMDYvMDQvbmljay1zemFiby8=)”).**Purchase",
      "original_url": "https://el2.fourhourmail.com/c/xmumv0zqqa6hp8vp7/41xkjn/aHR0cHM6Ly90d2l0dGVyLmNvbS9uYXZhbC9zdGF0dXMvODc3NDY3NjI5MzA4Mzk1NTIx",
      "links": [
        {
          "type": "original",
          "url": "https://el2.fourhourmail.com/c/xmumv0zqqa6hp8vp7/41xkjn/aHR0cHM6Ly90d2l0dGVyLmNvbS9uYXZhbC9zdGF0dXMvODc3NDY3NjI5MzA4Mzk1NTIx"
        },
        {
          "type": "other",
          "url": "https://el2.fourhourmail.com/c/xmumv0zqqa6hp8vp7/ly60ym/aHR0cHM6Ly90d2l0dGVyLmNvbS9DcnlwdG9ub29iaWUvc3RhdHVzLzg3NzUyNTQ5MjE2MDc1Nzc2MQ=="
        },
        {
          "type": "other",
          "url": "https://el2.fourhourmail.com/c/xmumv0zqqa6hp8vp7/gykm1o/aHR0cDovL3RpbS5ibG9nLzIwMTcvMDYvMDQvbmljay1zemFiby8="
        }
      ]
    },
    {
      "position": 3,
      "section": "I’m enjoying —",
      "category": "other",
      "title": "ENO (Eagles Nest Outfitters) DoubleNest Hammock",
      "creator": null,
      "note": "DoubleNest\nHammock](https://el2.fourhourmail.com/c/xmumv0zqqa6hp8vp7/vj52jo/aHR0cDovL2Ftem4udG8vMnRKRERwMQ==)\nwith **[**Suspension\nStraps**](https://el2.fourhourmail.com/c/xmumv0zqqa6hp8vp7/412oy0/aHR0cDovL2Ftem4udG8vMnNFMGt2eQ==)  \nA few weeks ago, I asked my social media following (~3-4M total) the following\nquestion: “What's the best lounging hammock for 2 people to hang/cuddle/read\nin? Any suggestions that you're 10-out-of-10 happy with? Thanks!” The #1 most\nrecommended was the ENO DoubleNest hammock with suspension straps, and it\ndidn’t disappoint. The straps, which are key, allowed me to set up the hammock\nbetween two trees in <60 seconds on my first try, and I fell asleep in the\nhammock within minutes. It all packs up tightly enough (to about the size of a\nlarge grapefruit) that you can put it in a backpack. If you decide to check it\nout, I suggest you [find your preferred color(s) on the ENO website\nhere](https://el2.fourhourmail.com/c/xmumv0zqqa6hp8vp7/9yq3jg/aHR0cHM6Ly93d3cuZWFnbGVzbmVzdG91dGZpdHRlcnNpbmMuY29tL3Nob3AvaGFtbW9ja3MvZG91YmxlbmVzdC1oYW1tb2NrLw==),\nthen order from whichever site you like (I ordered from Amazon\n[here](https://el2.fourhourmail.com/c/xmumv0zqqa6hp8vp7/qygvyg/aHR0cDovL2Ftem4udG8vMnRKRERwMQ==)\nand\n[here](https://el2.fourhourmail.com/c/xmumv0zqqa6hp8vp7/my93yl/aHR0cDovL2Ftem4udG8vMnNFMGt2eQ==)),\nas the color schemes can otherwise be very confusing. For instance, I chose\nthe “powder/orange/tan” based on Google images and the ENO website, and, in\nperson, it doesn’t seem to contain any orange or tan. Go figure. Regardless,\nI’m very happy with ENO so far, but with this caveat: I’ve only been using it\nsolo. For two-person use at home (not while camping or traveling), I suspect\nsomething with “spreader bars” that folds less might be more\ncomfortable.**",
      "original_url": "https://el2.fourhourmail.com/c/xmumv0zqqa6hp8vp7/vj52jo/aHR0cDovL2Ftem4udG8vMnRKRERwMQ==",
      "links": [
        {
          "type": "original",
          "url": "https://el2.fourhourmail.com/c/xmumv0zqqa6hp8vp7/vj52jo/aHR0cDovL2Ftem4udG8vMnRKRERwMQ=="
        },
        {
          "type": "other",
          "url": "https://el2.fourhourmail.com/c/xmumv0zqqa6hp8vp7/412oy0/aHR0cDovL2Ftem4udG8vMnNFMGt2eQ=="
        },
        {
          "type": "other",
          "url": "https://el2.fourhourmail.com/c/xmumv0zqqa6hp8vp7/9yq3jg/aHR0cHM6Ly93d3cuZWFnbGVzbmVzdG91dGZpdHRlcnNpbmMuY29tL3Nob3AvaGFtbW9ja3MvZG91YmxlbmVzdC1oYW1tb2NrLw=="
        },
        {
          "type": "other",
          "url": "https://el2.fourhourmail.com/c/xmumv0zqqa6hp8vp7/qygvyg/aHR0cDovL2Ftem4udG8vMnRKRERwMQ=="
        },
        {
          "type": "other",
          "url": "https://el2.fourhourmail.com/c/xmumv0zqqa6hp8vp7/my93yl/aHR0cDovL2Ftem4udG8vMnNFMGt2eQ=="
        }
      ]
    },
    {
      "position": 4,
      "section": "Most popular post on Instagram —",
      "category": "other",
      "title": "the beauty of life",
      "creator": null,
      "note": "Watch the stars, and see yourself running with them...\"**",
      "original_url": "https://el2.fourhourmail.com/c/xmumv0zqqa6hp8vp7/7j3wyk/aHR0cHM6Ly93d3cuaW5zdGFncmFtLmNvbS9wL0JXSzRnZGxsNV9yLz90YWtlbi1ieT10aW1mZXJyaXNz",
      "links": [
        {
          "type": "original",
          "url": "https://el2.fourhourmail.com/c/xmumv0zqqa6hp8vp7/7j3wyk/aHR0cHM6Ly93d3cuaW5zdGFncmFtLmNvbS9wL0JXSzRnZGxsNV9yLz90YWtlbi1ieT10aW1mZXJyaXNz"
        }
      ]
    },
    {
      "position": 5,
      "section": "Quote I’m pondering —",
      "category": "quote",
      "title": "I’m going to cheat this week and give you two closely related quotes from the same person. Bolding is mine:“Wild animals run from the dangers they actually see, and once they have escaped them worry no more. We however are tormented alike by what is past and what is to come. A number of our blessings do us harm, for memory brings back the agony of fear while foresight brings it on prematurely. No one confines his unhappiness to the present. ” … “He suffers more than necessary, who suffers before it is necessary ” – Seneca",
      "creator": "Seneca",
      "note": null,
      "original_url": "https://el2.fourhourmail.com/c/xmumv0zqqa6hp8vp7/qjnejk/aHR0cHM6Ly90d2l0dGVyLmNvbS90ZmVycmlzcw==",
      "links": [
        {
          "type": "original",
          "url": "https://el2.fourhourmail.com/c/xmumv0zqqa6hp8vp7/qjnejk/aHR0cHM6Ly90d2l0dGVyLmNvbS90ZmVycmlzcw=="
        }
      ]
    }
  ]
}
