{
  "schema_version": 1,
  "issue_date": "2026-03-13",
  "subject": "5-Bullet Friday — The Series That Bends Reality, Easy Cooking Upgrades, Stephen King on Polite Society, and Strange but Sensible Housing",
  "sources": [
    "gmail",
    "hotmail"
  ],
  "status": "email",
  "extraction_status": "metadata_only",
  "special_edition": true,
  "bullets": []
}
