{
  "schema_version": 1,
  "issue_date": "2021-08-27",
  "subject": "5-Bullet Friday — August 27, 2021",
  "sources": [
    "hotmail"
  ],
  "status": "email",
  "extraction_status": "extracted",
  "special_edition": true,
  "bullets": [
    {
      "position": 1,
      "section": "Podcast episode I’m listening to —",
      "category": "podcast",
      "title": "From Cod Fishing to Kelp Farming",
      "creator": null,
      "note": "(my title) with [Dr. Ayana Elizabeth Johnson](https://www.ayanaelizabeth.com/) ([@ayanaeliza](https://twitter.com/ayanaeliza)) and [Alex Blumberg](https://tim.blog/2015/01/29/alex-blumberg/?utm_source=convertkit&utm_medium=convertkit&utm_campaign=5bf) ([@abexlumberg](https://twitter.com/abexlumberg?lang=en)). For many reasons, I’m considering investing heavily in aquaculture, so I’ve been doing a deep dive—pun intended—into the subject. This episode is incredibly smart, incredibly helpful, and… incredibly hilarious. I didn’t expect the characters involved and kept bursting out laughing at the gym this morning. I looked like a crazy person but kept on listening. Whether you want an investing advantage or simply great stories, this episode is really worth the time. And if you’d like to learn storytelling and podcasting tips from one of the co-hosts, [Alex Blumberg](https://twitter.com/abexlumberg?lang=en), you can find [my 2015 interview](https://tim.blog/2015/01/29/alex-blumberg/?utm_source=convertkit&utm_medium=convertkit&utm_campaign=5bf) with him [here](https://tim.blog/2015/01/29/alex-blumberg/?utm_source=convertkit&utm_medium=convertkit&utm_campaign=5bf).",
      "original_url": "https://open.spotify.com/episode/093q8GaZB5OAZJClUUSKx5?si=AUq5aX-PRrOVV9E3tZ7XjA&context=spotify%3Ashow%3A1KzrasExlM5dgMYwgFHns6&dl_branch=1",
      "links": [
        {
          "type": "original",
          "url": "https://open.spotify.com/episode/093q8GaZB5OAZJClUUSKx5?si=AUq5aX-PRrOVV9E3tZ7XjA&context=spotify%3Ashow%3A1KzrasExlM5dgMYwgFHns6&dl_branch=1"
        },
        {
          "type": "other",
          "url": "https://www.ayanaelizabeth.com/"
        },
        {
          "type": "other",
          "url": "https://twitter.com/ayanaeliza"
        },
        {
          "type": "other",
          "url": "https://tim.blog/2015/01/29/alex-blumberg/?utm_source=convertkit&utm_medium=convertkit&utm_campaign=5bf"
        },
        {
          "type": "other",
          "url": "https://twitter.com/abexlumberg?lang=en"
        },
        {
          "type": "other",
          "url": "https://twitter.com/abexlumberg?lang=en"
        },
        {
          "type": "other",
          "url": "https://tim.blog/2015/01/29/alex-blumberg/?utm_source=convertkit&utm_medium=convertkit&utm_campaign=5bf"
        },
        {
          "type": "other",
          "url": "https://tim.blog/2015/01/29/alex-blumberg/?utm_source=convertkit&utm_medium=convertkit&utm_campaign=5bf"
        }
      ]
    },
    {
      "position": 2,
      "section": "Snack I’m enjoying —",
      "category": "other",
      "title": "Santa Barbara Chile Lemon Pistachios",
      "creator": null,
      "note": "Description: “The zest of habanero pepper and the zing of lemon combine to create a crisp, lively tasting pistachio. Our Chile Lemon is mild enough, yet wild enough. All organic.” Thanks to JZ from [_The 4-Hour Chef_](https://www.amazon.com/4-Hour-Chef-Cooking-Learning-Anything/dp/1328519163/ref=mp_s_a_1_2?dchild=1&keywords=4-hour+chef+ferriss&qid=1630000729&sr=8-2) for this amazing recommendation. Be forewarned that you will eat these quickly.",
      "original_url": "https://www.santabarbarapistachios.com/shop-pistachios-santa-barbara#!/Chile-Lemon-Organic-In-Shell-Pistachios/p/62066743/category=18513096",
      "links": [
        {
          "type": "original",
          "url": "https://www.santabarbarapistachios.com/shop-pistachios-santa-barbara#!/Chile-Lemon-Organic-In-Shell-Pistachios/p/62066743/category=18513096"
        },
        {
          "type": "other",
          "url": "https://www.amazon.com/4-Hour-Chef-Cooking-Learning-Anything/dp/1328519163/ref=mp_s_a_1_2?dchild=1&keywords=4-hour+chef+ferriss&qid=1630000729&sr=8-2"
        }
      ]
    },
    {
      "position": 3,
      "section": "What I’m watching (long) —",
      "category": "video",
      "title": "100 Foot Wave",
      "creator": null,
      "note": "This HBO miniseries is blowing my mind. Both my girlfriend and I are loving it. Description: “Surfing pioneer [Garrett McNamara](https://en.wikipedia.org/wiki/Garrett_McNamara)’s \\[[@mcnamara\\_s](https://www.instagram.com/mcnamara_s/)\\] quest to conquer a 100-foot wave and its transformation of Nazare, Portugal, is detailed in this series.” That tepid description does not do it justice, however. **At the very least,** [**watch this short trailer**](https://www.youtube.com/watch?v=znCNT-9k_Ws) **to get your heart rate up.** Holy #$%&. SOME WEIRD LOGISTICS: I am watching this on HBO Max through Amazon Prime, but HBO left Prime this month (see: “[HBO Is About to Lose 5 Million Customers. It’s Not Concerned.](https://www.bloomberg.com/news/newsletters/2021-08-22/hbo-is-about-to-lose-5-million-customers-it-s-not-concerned)”). **However**, it appears current HBO subscribers on Prime like me can still [watch the series on Amazon at this link](https://www.amazon.com/Chapter-I-Sea-Monsters/dp/B098RBMJV9/ref=sr_1_fkmr0_1?dchild=1&keywords=100+foot+wave&qid=1630076232&sr=8-1-fkmr0): “If you had HBO through Prime Video, you can still access your content on HBO Max by signing in with your Prime Video credentials… If you have HBO on Prime Video Channels, you can sign in through Prime Video Channels and stream all of HBO Max.” Otherwise, you’ll need to use the [HBO Max link here](https://www.hbomax.com/series/urn:hbo:series:GYK6A0wdFMsMdJgEAAAAJ). Personally and selfishly, I hope other services remain on Amazon. I really don’t want to have separate accounts and logins for every channel.",
      "original_url": "https://www.hbomax.com/series/urn:hbo:series:GYK6A0wdFMsMdJgEAAAAJ",
      "links": [
        {
          "type": "original",
          "url": "https://www.hbomax.com/series/urn:hbo:series:GYK6A0wdFMsMdJgEAAAAJ"
        },
        {
          "type": "other",
          "url": "https://en.wikipedia.org/wiki/Garrett_McNamara"
        },
        {
          "type": "other",
          "url": "https://www.instagram.com/mcnamara_s/"
        },
        {
          "type": "other",
          "url": "https://www.youtube.com/watch?v=znCNT-9k_Ws"
        },
        {
          "type": "other",
          "url": "https://www.bloomberg.com/news/newsletters/2021-08-22/hbo-is-about-to-lose-5-million-customers-it-s-not-concerned"
        },
        {
          "type": "other",
          "url": "https://www.amazon.com/Chapter-I-Sea-Monsters/dp/B098RBMJV9/ref=sr_1_fkmr0_1?dchild=1&keywords=100+foot+wave&qid=1630076232&sr=8-1-fkmr0"
        },
        {
          "type": "other",
          "url": "https://www.hbomax.com/series/urn:hbo:series:GYK6A0wdFMsMdJgEAAAAJ"
        }
      ]
    },
    {
      "position": 4,
      "section": "What I’m watching (short) —",
      "category": "video",
      "title": "Fox Calls",
      "creator": null,
      "note": "I am doing some field identification in forests nearby, and I found this video quite helpful for distinguishing fox from coyote cubs and other creatures. Here is the description, slightly edited for clarity: “In this video, you will learn a few different fox calls and sounds and what they mean. Foxes can make more than 40 calls and sounds: contact calls, interaction calls, etc. Foxes are normally quiet animals, and their calls are mostly heard during the mating season when foxes are calling out to each other and fighting over territory. Fox cubs are very quiet and only make sounds when they are playing, fighting, or nursing. Most of the time, fox calls are mistaken for the call of another animal.”",
      "original_url": "https://youtu.be/J6NuhlibHsM",
      "links": [
        {
          "type": "original",
          "url": "https://youtu.be/J6NuhlibHsM"
        }
      ]
    },
    {
      "position": 5,
      "section": "Quote I’m pondering —",
      "category": "quote",
      "title": "“Nothing is a greater impediment to being on good terms with others than being ill at ease with yourself.” — Honoré de Balzac And, as always, please give me feedback on Twitter. Which bullet above is your favorite? What do you want more or less of? Other suggestions? Please let me know. Just send a tweet to @tferriss and put #5BulletFriday at the end so I can find it. Have a wonderful weekend, all. Much love to you and yours, Tim",
      "creator": "Honoré de Balzac And, as always, please give me feedback on Twitter. Which bullet above is your favorite? What do you want more or less of? Other suggestions? Please let me know. Just send a tweet to @tferriss and put #5BulletFriday at the end so I can find it. Have a wonderful weekend, all. Much love to you and yours, Tim",
      "note": null,
      "original_url": "https://en.wikipedia.org/wiki/Honor%C3%A9_de_Balzac",
      "links": [
        {
          "type": "original",
          "url": "https://en.wikipedia.org/wiki/Honor%C3%A9_de_Balzac"
        },
        {
          "type": "other",
          "url": "https://twitter.com/tferriss"
        }
      ]
    }
  ]
}
